[
  {
    "id": "GOV-001",
    "domain": "Governance",
    "title": "Security governance responsibilities are defined",
    "frameworks": ["NIST CSF 2.0", "ISO 27001", "SOC 2"],
    "expectedEvidence": [
      "security_owner_defined",
      "security_policy_exists",
      "risk_management_process_defined"
    ]
  },
  {
    "id": "IAM-001",
    "domain": "Identity and Access Management",
    "title": "Access to systems is controlled using least privilege",
    "frameworks": ["NIST CSF 2.0", "ISO 27001", "SOC 2", "GDPR"],
    "expectedEvidence": [
      "mfa_enabled",
      "rbac_defined",
      "privileged_access_reviewed"
    ]
  },
  {
    "id": "SDLC-001",
    "domain": "Secure Software Development",
    "title": "Code changes are reviewed before being merged",
    "frameworks": ["NIST CSF 2.0", "ISO 27001", "SOC 2", "OWASP"],
    "expectedEvidence": [
      "branch_protection_enabled",
      "pull_request_reviews_required",
      "codeowners_configured"
    ]
  },
  {
    "id": "VULN-001",
    "domain": "Vulnerability Management",
    "title": "Dependencies and code are scanned for vulnerabilities",
    "frameworks": ["NIST CSF 2.0", "ISO 27001", "SOC 2", "OWASP"],
    "expectedEvidence": [
      "dependabot_enabled",
      "codeql_enabled",
      "dependency_review_enabled"
    ]
  },
  {
    "id": "LOG-001",
    "domain": "Logging and Monitoring",
    "title": "Security-relevant events are logged and monitored",
    "frameworks": ["NIST CSF 2.0", "ISO 27001", "SOC 2", "GDPR"],
    "expectedEvidence": [
      "application_logs_enabled",
      "cloud_audit_logs_enabled",
      "alerting_process_defined"
    ]
  },
  {
    "id": "PRIV-001",
    "domain": "Privacy and Data Protection",
    "title": "Personal data processing is documented and controlled",
    "frameworks": ["GDPR", "ISO 27001", "SOC 2"],
    "expectedEvidence": [
      "data_inventory_exists",
      "privacy_notice_exists",
      "data_retention_defined"
    ]
  },
  {
    "id": "AI-001",
    "domain": "AI Governance",
    "title": "AI system purpose, data flow and risks are documented",
    "frameworks": ["EU AI Act", "NIST CSF 2.0", "OWASP LLM"],
    "expectedEvidence": [
      "ai_system_description_exists",
      "ai_data_flow_documented",
      "human_oversight_defined",
      "prompt_injection_risk_assessed"
    ]
  },
  {
    "id": "APP-001",
    "domain": "Application Security",
    "title": "Authentication and authorization are documented and reviewed",
    "frameworks": ["OWASP", "NIST CSF 2.0", "SOC 2", "ISO 27001"],
    "expectedEvidence": [
      "authentication_mechanism_documented",
      "authorization_checks_documented"
    ]
  },
  {
    "id": "APP-002",
    "domain": "Application Security",
    "title": "Input validation and secure error handling are documented",
    "frameworks": ["OWASP", "NIST CSF 2.0", "SOC 2"],
    "expectedEvidence": [
      "input_validation_documented",
      "secure_error_handling_documented"
    ]
  },
  {
    "id": "APP-003",
    "domain": "Application Security",
    "title": "Secrets management and abuse prevention are reviewed",
    "frameworks": ["OWASP", "SOC 2", "ISO 27001"],
    "expectedEvidence": [
      "secrets_management_documented",
      "rate_limiting_reviewed"
    ]
  },
  {
    "id": "CLOUD-001",
    "domain": "Cloud Security",
    "title": "Cloud provider, IAM and privileged access are reviewed",
    "frameworks": ["NIST CSF 2.0", "ISO 27001", "SOC 2"],
    "expectedEvidence": [
      "cloud_provider_documented",
      "cloud_iam_review_documented"
    ]
  },
  {
    "id": "CLOUD-002",
    "domain": "Cloud Security",
    "title": "Cloud encryption and backup controls are reviewed",
    "frameworks": ["NIST CSF 2.0", "ISO 27001", "SOC 2", "GDPR"],
    "expectedEvidence": [
      "encryption_at_rest_reviewed",
      "encryption_in_transit_reviewed",
      "backup_recovery_documented"
    ]
  },
  {
    "id": "PRIV-002",
    "domain": "Privacy and Data Protection",
    "title": "GDPR roles, agreements and data subject processes are reviewed",
    "frameworks": ["GDPR", "ISO 27001", "SOC 2"],
    "expectedEvidence": [
      "controller_processor_roles_reviewed",
      "dpa_reviewed",
      "data_subject_rights_process_documented"
    ]
  },
  {
    "id": "AI-002",
    "domain": "AI Governance",
    "title": "AI vendor and transparency obligations are reviewed",
    "frameworks": ["EU AI Act", "GDPR", "OWASP LLM"],
    "expectedEvidence": [
      "ai_vendor_review_documented",
      "ai_transparency_notice_reviewed"
    ]
  }
]
